{
  "contract_version": "atlas.vercel_hobby_review.v1",
  "repo_id": "fitness",
  "checkpoint_status": "ready",
  "decision": "keep_hobby",
  "accepted_signature_digest": "sha256:4097889236a2af26c293033feb964c4cf118c0224e0d063fec0a89e9d0569ef2",
  "accepted_drift_fields": ["edge_requests_per_month"],
  "target_sha": "0000000000000000000000000000000000000000",
  "decision_reason": "edge request drift reviewed against current traffic baseline and accepted",
  "next_action": "stay on Hobby by default and refresh the checkpoint on the next governed cadence"
}
